### ISSUE TITLE
Retry when status is in status_forcelist and don't use the same connection

### ISSUE THREAD

**Issue by masteralves** [urllib3/urllib3#1158]
Hey folks,

I am trying to use urllib connectionpool.request so that when we get a status code that is in the status_forcelist, the same connection isn't reused for the retries. I tried using `release_conn=False` and then calling `.release_conn()`, but by inspecting the code, it looks like this is only releasing the last used connection. 
Assuming that we fail the 1st try and then we succeed the 2nd, the 1st connection is never released. Then I imagine we would have a problem of leaking connections.
Is this a bug, or is there something I'm missing here?

Cheers

**Comment by Lukasa** [comment]
So, I wrote a test script:

```python
import urllib3

http = urllib3.HTTPConnectionPool(host='httpbin.org')
retry = urllib3.Retry(total=1, status=1, status_forcelist=[404], raise_on_status=False)

resp = http.request('GET', '/status/404', retries=retry)
print(resp.status)
```

Produces the following tcpdump output:

```
12:45:22.795720 IP 192.168.1.3.50182 > 50.16.195.223.80: Flags [S], seq 2772615110, win 65535, options [mss 1460,nop,wscale 5,nop,nop,TS val 494752945 ecr 0,sackOK,eol], length 0
12:45:22.896051 IP 50.16.195.223.80 > 192.168.1.3.50182: Flags [S.], seq 156185054, ack 2772615111, win 26847, options [mss 1452,sackOK,TS val 26566565 ecr 494752945,nop,wscale 8], length 0
12:45:22.896170 IP 192.168.1.3.50182 > 50.16.195.223.80: Flags [.], ack 1, win 4140, options [nop,nop,TS val 494753044 ecr 26566565], length 0
12:45:22.896310 IP 192.168.1.3.50182 > 50.16.195.223.80: Flags [P.], seq 1:75, ack 1, win 4140, options [nop,nop,TS val 494753044 ecr 26566565], length 74: HTTP: GET /status/404 HTTP/1.1
12:45:22.988213 IP 50.16.195.223.80 > 192.168.1.3.50182: Flags [.], ack 75, win 105, options [nop,nop,TS val 26566588 ecr 494753044], length 0
12:45:22.992870 IP 50.16.195.223.80 > 192.168.1.3.50182: Flags [P.], seq 1:260, ack 75, win 105, options [nop,nop,TS val 26566589 ecr 494753044], length 259: HTTP: HTTP/1.1 404 NOT FOUND
12:45:22.992958 IP 192.168.1.3.50182 > 50.16.195.223.80: Flags [.], ack 260, win 4131, options [nop,nop,TS val 494753138 ecr 26566589], length 0
12:45:22.994265 IP 192.168.1.3.50182 > 50.16.195.223.80: Flags [P.], seq 75:149, ack 260, win 4131, options [nop,nop,TS val 494753139 ecr 26566589], length 74: HTTP: GET /status/404 HTTP/1.1
12:45:23.090777 IP 50.16.195.223.80 > 192.168.1.3.50182: Flags [P.], seq 260:519, ack 149, win 105, options [nop,nop,TS val 26566613 ecr 494753139], length 259: HTTP: HTTP/1.1 404 NOT FOUND
12:45:23.091018 IP 192.168.1.3.50182 > 50.16.195.223.80: Flags [.], ack 519, win 4123, options [nop,nop,TS val 494753235 ecr 26566613], length 0
12:45:23.097889 IP 192.168.1.3.50182 > 50.16.195.223.80: Flags [F.], seq 149, ack 519, win 4123, options [nop,nop,TS val 494753241 ecr 26566613], length 0
12:45:23.190711 IP 50.16.195.223.80 > 192.168.1.3.50182: Flags [F.], seq 519, ack 150, win 105, options [nop,nop,TS val 26566639 ecr 494753241], length 0
12:45:23.190985 IP 192.168.1.3.50182 > 50.16.195.223.80: Flags [.], ack 520, win 4123, options [nop,nop,TS val 494753333 ecr 26566639], length 0
```

You'll notice in this tcpdump output that no second connection is created: that is, there is only one SYN -> SYN+ACK -> ACK handshake at the top, and no second handshake, despite that both requests are clearly visible.

So, I guess my question is: what does your code look like, and are you *sure* you're getting two different TCP connections?

**Comment by masteralves** [comment]
Thanks for the fast response! So, you're right. I missed the `self.release_conn()` in response.py. That's where connections are being released back to the pool before the retry. I didn't actually test my code to check if I was getting two different connections, I did so now and in fact it is only one - your script produces the same output.

Having said that, then is there any way I can change your script so it uses a different TCP connection for the retry? 

The reason I need this is because I'm calling a service that sits in 4 machines behind an ELB. If the first attempt fails, I would rather start a new connection, so that the ELB routes it to one of the other 3 machines (assuming the first one returned a 5xx error and is in a faulty state)

**Comment by Lukasa** [comment]
Yeah, set `release_conn=False` and call `close` and then `release_conn` on the response. That *should* force the TCP connection closed, though you should validate it via tcpdump.

**Comment by masteralves** [comment]
You mean something like this?
```
import urllib3

http = urllib3.HTTPConnectionPool(host='httpbin.org', maxsize=50)
retry = urllib3.Retry(total=1, status=1, status_forcelist=[404], raise_on_status=False)

resp = http.request('GET', '/status/404', release_conn=False, retries=retry)
resp._connection.close()
resp.release_conn()
print(resp.status)
```
It is still using the same connection for all tries... I'm not sure where I should be calling close.

**Comment by Lukasa** [comment]
No, just `resp.close()`.

**Comment by masteralves** [comment]
Oh, yeah... but the problem is still there. It is still using the same connection for the 2 tries. Then I would have to implement my own retry logic and not use the `Retry` object at all to make it work. It could be done, but I'd rather have the solution come from within urllib.

**Comment by Lukasa** [comment]
Hrm. This ends up being a really tricky thing for urllib3 to handle. We could, I suppose, add logic to the retry handler to allow closing the connection but at a certain point the retry handler becomes just absurdly complex, and it's already pretty damn complex. This may ultimately have to be flagged as beyond the scope of urllib3.

**Comment by mattbillenstein** [comment]
Possibly related:  https://github.com/kennethreitz/requests/issues/3993

**Comment by sethmlarson** [comment]
I'm going to close this as out of scope.
